{
  "$schema": "https://json-schema.org/draft/2020-12/schema",
  "$id": "https://contracts.cp6.uk/events/platform/permission-changed/v3/schema.json",
  "type": "object",
  "required": [
    "specversion",
    "id",
    "source",
    "type",
    "subject",
    "time",
    "datacontenttype",
    "dataschema",
    "tenantid",
    "correlationid",
    "causationid",
    "aggregateid",
    "aggregateversion",
    "schemaversion",
    "region",
    "data"
  ],
  "properties": {
    "specversion": {
      "const": "1.0"
    },
    "id": {
      "type": "string",
      "minLength": 1,
      "maxLength": 128,
      "pattern": "^[A-Za-z0-9][A-Za-z0-9._:-]*$"
    },
    "source": {
      "const": "urn:cp6:platform"
    },
    "type": {
      "const": "com.gtx537.platform.permission.changed.v3"
    },
    "subject": {
      "type": "string",
      "minLength": 1,
      "maxLength": 512
    },
    "time": {
      "type": "string",
      "format": "date-time",
      "pattern": "Z$"
    },
    "datacontenttype": {
      "const": "application/json"
    },
    "dataschema": {
      "const": "https://contracts.cp6.uk/events/platform/permission-changed/v3/schema.json"
    },
    "tenantid": {
      "type": "string",
      "format": "uuid",
      "pattern": "^[0-9a-f]{8}-[0-9a-f]{4}-[0-9a-f]{4}-[0-9a-f]{4}-[0-9a-f]{12}$",
      "not": {
        "const": "00000000-0000-0000-0000-000000000000"
      }
    },
    "correlationid": {
      "type": "string",
      "minLength": 1,
      "maxLength": 128,
      "pattern": "^[A-Za-z0-9][A-Za-z0-9._:-]*$"
    },
    "causationid": {
      "type": "string",
      "minLength": 1,
      "maxLength": 128,
      "pattern": "^[A-Za-z0-9][A-Za-z0-9._:-]*$"
    },
    "aggregateid": {
      "type": "string",
      "minLength": 1,
      "maxLength": 128,
      "pattern": "^[A-Za-z0-9][A-Za-z0-9._:-]*$"
    },
    "aggregateversion": {
      "type": "integer",
      "minimum": 1,
      "maximum": 2147483647
    },
    "schemaversion": {
      "const": "3.0.0"
    },
    "region": {
      "type": "string",
      "pattern": "^[a-z][a-z0-9-]{1,31}$"
    },
    "data": {
      "type": "object",
      "required": [
        "tenantId",
        "subjectId",
        "enabled",
        "grants",
        "version",
        "siteFormScopes"
      ],
      "properties": {
        "tenantId": {
          "type": "string",
          "format": "uuid",
          "pattern": "^[0-9a-f]{8}-[0-9a-f]{4}-[0-9a-f]{4}-[0-9a-f]{4}-[0-9a-f]{12}$",
          "not": {
            "const": "00000000-0000-0000-0000-000000000000"
          }
        },
        "version": {
          "type": "integer",
          "minimum": 1,
          "maximum": 2147483647
        },
        "subjectId": {
          "type": "string",
          "minLength": 1,
          "maxLength": 128,
          "pattern": "^(?:role:(?:0|(?:[1-9][0-9]{0,8}|1[0-9]{9}|20[0-9]{8}|21[0-3][0-9]{7}|214[0-6][0-9]{6}|2147[0-3][0-9]{5}|21474[0-7][0-9]{4}|214748[0-2][0-9]{3}|2147483[0-5][0-9]{2}|21474836[0-3][0-9]{1}|214748364[0-6]|2147483647)|-(?:[1-9][0-9]{0,8}|1[0-9]{9}|20[0-9]{8}|21[0-3][0-9]{7}|214[0-6][0-9]{6}|2147[0-3][0-9]{5}|21474[0-7][0-9]{4}|214748[0-2][0-9]{3}|2147483[0-5][0-9]{2}|21474836[0-3][0-9]{1}|214748364[0-7]|2147483648))|user:[0-9a-f-]{36})$"
        },
        "enabled": {
          "type": "boolean"
        },
        "grants": {
          "type": "array",
          "maxItems": 4096,
          "uniqueItems": true,
          "items": {
            "type": "object",
            "required": [
              "resource",
              "action",
              "scope",
              "deptIds",
              "fields"
            ],
            "properties": {
              "resource": {
                "type": "string",
                "minLength": 1,
                "maxLength": 100,
                "pattern": "^[A-Za-z0-9][A-Za-z0-9._-]*$"
              },
              "action": {
                "type": "string",
                "minLength": 1,
                "maxLength": 100,
                "pattern": "^[A-Za-z0-9][A-Za-z0-9._-]*$"
              },
              "scope": {
                "type": "integer",
                "minimum": 1,
                "maximum": 5
              },
              "deptIds": {
                "type": "array",
                "uniqueItems": true,
                "maxItems": 2048,
                "items": {
                  "type": "string",
                  "format": "uuid",
                  "pattern": "^[0-9a-f]{8}-[0-9a-f]{4}-[0-9a-f]{4}-[0-9a-f]{4}-[0-9a-f]{12}$",
                  "not": {
                    "const": "00000000-0000-0000-0000-000000000000"
                  }
                }
              },
              "fields": {
                "type": "array",
                "maxItems": 512,
                "uniqueItems": true,
                "items": {
                  "type": "object",
                  "required": [
                    "field",
                    "access"
                  ],
                  "properties": {
                    "field": {
                      "type": "string",
                      "minLength": 1,
                      "maxLength": 100,
                      "pattern": "^[A-Za-z0-9][A-Za-z0-9._-]*$"
                    },
                    "access": {
                      "type": "integer",
                      "minimum": 1,
                      "maximum": 3
                    }
                  },
                  "propertyNames": {
                    "not": {
                      "enum": [
                        "name",
                        "displayName",
                        "userName",
                        "nickName",
                        "email",
                        "emailAddress",
                        "phone",
                        "mobile",
                        "password",
                        "passwordHash",
                        "cookie",
                        "token",
                        "accessToken",
                        "refreshToken",
                        "clientSecret",
                        "privateKey",
                        "authorization"
                      ]
                    }
                  }
                }
              }
            },
            "propertyNames": {
              "not": {
                "enum": [
                  "name",
                  "displayName",
                  "userName",
                  "nickName",
                  "email",
                  "emailAddress",
                  "phone",
                  "mobile",
                  "password",
                  "passwordHash",
                  "cookie",
                  "token",
                  "accessToken",
                  "refreshToken",
                  "clientSecret",
                  "privateKey",
                  "authorization"
                ]
              }
            }
          }
        },
        "deleted": {
          "type": "boolean"
        },
        "siteFormScopes": {
          "type": "array",
          "uniqueItems": true,
          "items": {
            "type": "object",
            "additionalProperties": false,
            "required": [
              "siteId",
              "formId"
            ],
            "properties": {
              "siteId": {
                "type": "string",
                "format": "uuid",
                "pattern": "^[0-9a-f]{8}-[0-9a-f]{4}-[0-9a-f]{4}-[0-9a-f]{4}-[0-9a-f]{12}$",
                "not": {
                  "const": "00000000-0000-0000-0000-000000000000"
                }
              },
              "formId": {
                "type": "string",
                "format": "uuid",
                "pattern": "^[0-9a-f]{8}-[0-9a-f]{4}-[0-9a-f]{4}-[0-9a-f]{4}-[0-9a-f]{12}$",
                "not": {
                  "const": "00000000-0000-0000-0000-000000000000"
                }
              }
            }
          }
        }
      },
      "propertyNames": {
        "not": {
          "enum": [
            "name",
            "displayName",
            "userName",
            "nickName",
            "email",
            "emailAddress",
            "phone",
            "mobile",
            "password",
            "passwordHash",
            "cookie",
            "token",
            "accessToken",
            "refreshToken",
            "clientSecret",
            "privateKey",
            "authorization"
          ]
        }
      }
    }
  },
  "propertyNames": {
    "not": {
      "enum": [
        "name",
        "displayName",
        "userName",
        "nickName",
        "email",
        "emailAddress",
        "phone",
        "mobile",
        "password",
        "passwordHash",
        "cookie",
        "token",
        "accessToken",
        "refreshToken",
        "clientSecret",
        "privateKey",
        "authorization"
      ]
    }
  }
}
